{
  "messageId": "7b0e6a52-5d1c-4c1e-9a53-2f7d9b3c4e01",
  "tipo": "GerarOrcamento",
  "versao": 1,
  "ocorridoEm": "2026-10-20T13:05:00.000Z",
  "origem": "os",
  "fluxoId": "3f2a1c9e-8b7d-4e6f-a5b4-c3d2e1f0a9b8",
  "osId": "9c8b7a6d-5e4f-4a3b-8c2d-1e0f9a8b7c6d",
  "numeroOs": "OS-2026-000123",
  "correlationId": "req-5f1e2d3c",
  "payload": {
    "cliente": {
      "id": "1a2b3c4d-5e6f-4a7b-8c9d-0e1f2a3b4c5d",
      "nome": "Maria Souza",
      "email": "maria@example.com",
      "documento": "52998224725"
    },
    "veiculo": {
      "placa": "ABC1D23",
      "marca": "Fiat",
      "modelo": "Argo"
    },
    "itens": [
      {
        "tipo": "SERVICO",
        "referenciaId": "2b3c4d5e-6f7a-4b8c-9d0e-1f2a3b4c5d6e",
        "descricao": "Troca de oleo",
        "quantidade": 1,
        "precoUnitarioCentavos": "120.00"
      },
      {
        "tipo": "INSUMO",
        "referenciaId": "3c4d5e6f-7a8b-4c9d-8e1f-2a3b4c5d6e7f",
        "descricao": "Oleo 5W30 1L",
        "quantidade": 4,
        "precoUnitarioCentavos": 4500
      }
    ],
    "valorTotalCentavos": 30000,
    "prazoAprovacaoEm": "2026-10-23T13:05:00.000Z",
    "prazoPagamentoMinutos": 2880
  }
}
