{
  "messageId": "2e7f1a3d-4d6c-4b90-8c3f-7a9b1d2e4f15",
  "tipo": "ExecucaoCancelada",
  "versao": 1,
  "ocorridoEm": "2026-10-20T16:06:10.000Z",
  "origem": "execution",
  "fluxoId": "3f2a1c9e-8b7d-4e6f-a5b4-c3d2e1f0a9b8",
  "osId": "9c8b7a6d-5e4f-4a3b-8c2d-1e0f9a8b7c6d",
  "numeroOs": "OS-2026-000123",
  "correlationId": "req-5f1e2d3c",
  "payload": {
    "etapa": null,
    "motivo": "Ordem de servico cancelada pelo atendimento."
  }
}
