{
  "messageId": "7b2c6d8a-9a1f-4e47-9f8c-2d4e6a7b9ca6",
  "tipo": "FalhaGerarOrcamento",
  "versao": 1,
  "ocorridoEm": "2026-10-20T13:05:10.000Z",
  "origem": "billing",
  "fluxoId": "3f2a1c9e-8b7d-4e6f-a5b4-c3d2e1f0a9b8",
  "osId": "9c8b7a6d-5e4f-4a3b-8c2d-1e0f9a8b7c6d",
  "numeroOs": "OS-2026-000123",
  "correlationId": "req-5f1e2d3c",
  "payload": {
    "motivo": "VALOR_TOTAL_INCONSISTENTE"
  }
}
