{
  "messageId": "7f2a6b84-9e1d-4c4b-9d8a-2b4c6e7f9a60",
  "tipo": "PagamentoEstornado",
  "versao": 1,
  "ocorridoEm": "2026-10-20T16:05:30.000Z",
  "origem": "billing",
  "fluxoId": "3f2a1c9e-8b7d-4e6f-a5b4-c3d2e1f0a9b8",
  "osId": "9c8b7a6d-5e4f-4a3b-8c2d-1e0f9a8b7c6d",
  "numeroOs": "OS-2026-000123",
  "correlationId": "req-5f1e2d3c",
  "payload": {
    "orcamentoId": null,
    "pagamentoId": null,
    "valorCentavos": 0
  }
}
