{
  "messageId": "3f8a2b4e-5e7d-4ca1-9d4a-8b0c2e3f5a26",
  "tipo": "FluxoConcluido",
  "versao": 1,
  "ocorridoEm": "2026-10-20T16:10:00.000Z",
  "origem": "os",
  "fluxoId": "3f2a1c9e-8b7d-4e6f-a5b4-c3d2e1f0a9b8",
  "osId": "9c8b7a6d-5e4f-4a3b-8c2d-1e0f9a8b7c6d",
  "numeroOs": "OS-2026-000123",
  "correlationId": "req-5f1e2d3c",
  "payload": {}
}
