{
  "messageId": "8a3b7c95-0f2e-4d5c-8e9b-3c5d7f8a0b71",
  "tipo": "EstornoFalhou",
  "versao": 1,
  "ocorridoEm": "2026-10-20T16:05:30.000Z",
  "origem": "billing",
  "fluxoId": "3f2a1c9e-8b7d-4e6f-a5b4-c3d2e1f0a9b8",
  "osId": "9c8b7a6d-5e4f-4a3b-8c2d-1e0f9a8b7c6d",
  "numeroOs": "OS-2026-000123",
  "correlationId": "req-5f1e2d3c",
  "payload": {
    "orcamentoId": "8b9c0d1e-2f3a-4b4c-9d5e-6f7a8b9c0d1e",
    "pagamentoId": "1234567890",
    "motivo": "Gateway de pagamento indisponivel no momento do estorno.",
    "proximaTentativaEm": "2026-10-20T16:20:30.000Z"
  }
}
