{
  "messageId": "8c3d7e9b-0b2a-4f58-8a9d-3e5f7b8c0db7",
  "tipo": "OrcamentoAprovado",
  "versao": 1,
  "ocorridoEm": "2026-10-20T14:00:00.000Z",
  "origem": "billing",
  "fluxoId": "3f2a1c9e-8b7d-4e6f-a5b4-c3d2e1f0a9b8",
  "osId": "9c8b7a6d-5e4f-4a3b-8c2d-1e0f9a8b7c6d",
  "numeroOs": "OS-2026-000123",
  "correlationId": "req-5f1e2d3c",
  "payload": {
    "orcamentoId": "8b9c0d1e-2f3a-4b4c-9d5e-6f7a8b9c0d1e",
    "linkPagamento": "https://www.mercadopago.com.br/checkout/v1/redirect?pref_id=1234567890-abcd-ef01-2345-6789abcdef01",
    "prazoPagamentoEm": "2026-10-22T14:00:00.000Z"
  }
}
