{
  "messageId": "2c7d1e35-4b6a-4f82-8a3d-7e9f1b2c4d51",
  "tipo": "ExecucaoEnfileirada",
  "versao": 1,
  "ocorridoEm": "2026-10-20T12:00:05.000Z",
  "origem": "execution",
  "fluxoId": "3f2a1c9e-8b7d-4e6f-a5b4-c3d2e1f0a9b8",
  "osId": "9c8b7a6d-5e4f-4a3b-8c2d-1e0f9a8b7c6d",
  "numeroOs": "OS-2026-000123",
  "correlationId": "req-5f1e2d3c",
  "payload": {
    "etapa": "DIAGNOSTICO",
    "ordemExecucaoId": "6f7a8b9c-0d1e-4f2a-9b3c-4d5e6f7a8b9c"
  }
}
