{
  "messageId": "1f4b9c20-3a5d-4e71-9b2c-6d8e0a1f3c40",
  "tipo": "SolicitarDiagnostico",
  "versao": 1,
  "ocorridoEm": "2026-10-20T12:00:00.000Z",
  "origem": "os",
  "fluxoId": "3f2a1c9e-8b7d-4e6f-a5b4-c3d2e1f0a9b8",
  "osId": "9c8b7a6d-5e4f-4a3b-8c2d-1e0f9a8b7c6d",
  "numeroOs": "OS-2026-000123",
  "correlationId": "req-5f1e2d3c",
  "payload": {
    "cliente": {
      "id": "1a2b3c4d-5e6f-4a7b-8c9d-0e1f2a3b4c5d",
      "nome": "Maria Souza"
    },
    "veiculo": {
      "id": "4d5e6f7a-8b9c-4d0e-9f1a-2b3c4d5e6f7a",
      "placa": "ABC1D23",
      "marca": "Fiat",
      "modelo": "Argo",
      "ano": 2021
    },
    "observacoesAtendimento": "Cliente relata barulho no motor em marcha lenta."
  }
}
