{
  "messageId": "4a9b3c5f-6f8e-4db2-8e5b-9c1d3f4a6b37",
  "tipo": "FluxoCompensado",
  "versao": 1,
  "ocorridoEm": "2026-10-20T16:10:00.000Z",
  "origem": "os",
  "fluxoId": "3f2a1c9e-8b7d-4e6f-a5b4-c3d2e1f0a9b8",
  "osId": "9c8b7a6d-5e4f-4a3b-8c2d-1e0f9a8b7c6d",
  "numeroOs": "OS-2026-000123",
  "correlationId": "req-5f1e2d3c",
  "payload": {
    "motivo": "Reparo declarado inviavel pela execucao.",
    "compensacoes": [
      "EstornarPagamento",
      "CancelarOrcamento",
      "EstornarReservaEstoque"
    ]
  }
}
