{
  "messageId": "1f6a0b2e-3e5d-4c8b-9d2a-6b8c0e1f3a0a",
  "tipo": "IniciarReparo",
  "versao": 1,
  "ocorridoEm": "2026-10-20T14:10:05.000Z",
  "origem": "os",
  "fluxoId": "3f2a1c9e-8b7d-4e6f-a5b4-c3d2e1f0a9b8",
  "osId": "9c8b7a6d-5e4f-4a3b-8c2d-1e0f9a8b7c6d",
  "numeroOs": "OS-2026-000123",
  "correlationId": "req-5f1e2d3c",
  "payload": {
    "itensServico": [
      {
        "itemId": "9c0d1e2f-3a4b-4c5d-8e6f-7a8b9c0d1e2f",
        "servicoId": "2b3c4d5e-6f7a-4b8c-9d0e-1f2a3b4c5d6e",
        "nome": "Troca de oleo",
        "quantidade": 1,
        "tempoEstimadoMin": 60
      }
    ],
    "itensInsumo": [
      {
        "insumoId": "3c4d5e6f-7a8b-4c9d-8e1f-2a3b4c5d6e7f",
        "nome": "Oleo 5W30 1L",
        "quantidade": 4
      }
    ]
  }
}
